email,name,minat,ekskul,skill,club_count,contribution,achievement
marialewar36@gmail.com,GITA ,IPA,Debat,"Publik Speaking, Menulis, Desain, Kolaborasi, Problem Solving",2,3.0,3.0
marialewar36@gmail.com,IIS,IPA,OSIS,"Publik Speaking, Menulis, Desain, Kolaborasi",1,3.0,3.0
marialewar36@gmail.com,IIS,IPA,OSIS,"Publik Speaking, Menulis, Desain, Kolaborasi, Problem Solving",1,3.0,3.0
marialewar36@gmail.com,GITA ,Bahasa,Debat,"Analisis Data, Leadership, Negosiasi, Kreativitas, Ketekunan",1,3.0,3.0
marialewar36@gmail.com,GITA ,IPS,Pramuka,"Analisis Data, Menulis, Leadership, Desain, Kolaborasi",1,3.0,3.0
marialewar36@gmail.com,GITA ,Bahasa,Debat,"Analisis Data, Leadership, Negosiasi, Ketekunan",1,3.0,3.0
